{
  "metadata": {
    "id": "urn:starlight:academy-pack:ai-architect-0.1.0",
    "schemaVersion": "0.1.0",
    "recordVersion": "0.1.0",
    "revision": 1,
    "scope": "tenant",
    "tenantRef": { "id": "urn:starlight:org:academy-001", "kind": "academy" },
    "academyRef": "urn:starlight:academy:ai-architect",
    "stewardRef": { "id": "urn:starlight:human:steward-001", "kind": "human" },
    "createdAt": "2026-08-29T10:00:00Z",
    "createdByRef": { "id": "urn:starlight:human:steward-001", "kind": "human" },
    "updatedAt": "2026-08-29T10:00:00Z",
    "updatedByRef": { "id": "urn:starlight:human:steward-001", "kind": "human" },
    "visibility": "public",
    "dataClassification": "public",
    "maturity": "active",
    "nextReviewAt": "2026-11-29T10:00:00Z",
    "license": {
      "licenseId": "MIT",
      "rightsHolderRefs": [{ "id": "urn:starlight:org:academy-001", "kind": "academy" }],
      "attribution": "Starlight Intelligence Academy Commons"
    },
    "provenance": {
      "contentDigest": "sha256:aaaaaaaaaaaaaaaaaaaaaaaaaaaaaaaaaaaaaaaaaaaaaaaaaaaaaaaaaaaaaaaa",
      "createdByRefs": [{ "id": "urn:starlight:human:steward-001", "kind": "human" }]
    }
  },
  "slug": "ai-architect-graph-engineering-commons",
  "name": "AI Architect Graph Engineering Commons",
  "purpose": "Help any learner design, operate, and defend governed human-agent execution graphs through an open local or BYOK path.",
  "releaseStatus": "published",
  "publishedAt": "2026-08-29T10:00:00Z",
  "ownerOrganisationRef": { "id": "urn:starlight:org:academy-001", "kind": "academy" },
  "issuerOrganisationRefs": [{ "id": "urn:starlight:org:academy-001", "kind": "academy" }],
  "covenantRef": {
    "id": "urn:starlight:policy:human-agent-learning-covenant",
    "version": "0.1.0",
    "digest": "sha256:bbbbbbbbbbbbbbbbbbbbbbbbbbbbbbbbbbbbbbbbbbbbbbbbbbbbbbbbbbbbbbbb"
  },
  "brandSurface": "ai_architect_academy",
  "institutionForms": ["commons", "studio", "guild", "certification_lab", "ombuds"],
  "competencyFrameworkRefs": [{
    "id": "urn:starlight:competency-framework:ai-architect",
    "version": "0.1.0",
    "digest": "sha256:cccccccccccccccccccccccccccccccccccccccccccccccccccccccccccccccc"
  }],
  "pathways": [{
    "id": "urn:starlight:pathway:graph-engineering-commons",
    "name": "Graph Engineering Commons",
    "status": "pilot",
    "missionTemplateRefs": [{
      "id": "urn:starlight:mission-template:graph-or-no-graph",
      "version": "0.1.0",
      "digest": "sha256:dddddddddddddddddddddddddddddddddddddddddddddddddddddddddddddddd"
    }],
    "entryCriteria": ["A bounded system objective and accountable human are named."],
    "exitCompetencyRefs": ["urn:starlight:competency:graph-system-shape"]
  }],
  "guardianModel": {
    "servicePath": ["guardian_agent", "peer_guild", "trained_mentor", "faculty_clinic"],
    "humanEscalationRequired": true,
    "roleDefinitions": [{
      "role": "evidence_verifier",
      "accountability": "Preflight evidence integrity and reproducibility.",
      "authorityBoundary": "May report findings; may not award or revoke credentials."
    }]
  },
  "policyRefs": [{
    "id": "urn:starlight:policy:assessment-001",
    "version": "0.1.0",
    "digest": "sha256:eeeeeeeeeeeeeeeeeeeeeeeeeeeeeeeeeeeeeeeeeeeeeeeeeeeeeeeeeeeeeeee"
  }],
  "commonsContributionRule": {
    "mode": "either",
    "approvalRequired": true
  },
  "openAccessContract": {
    "completePathWithoutPayment": true,
    "localOrByokExecutionSupported": true,
    "credentialEligibilityWithoutPayment": true,
    "exportWithoutPayment": true,
    "identicalAssessmentStandard": true,
    "managedServiceOptional": true,
    "freeCoreIncludes": ["capability_graph", "curriculum", "missions", "skills", "plugin_manifests", "reference_agent_definitions", "rubrics_and_evaluators", "public_fixtures", "local_runner", "passport_export", "credential_eligibility"],
    "hostedComputePolicy": "transparent_quota",
    "paidDifferentiators": ["managed_compute", "managed_hosting", "privacy_and_isolation", "integrations", "institutional_controls", "observability", "backups", "human_review_turnaround", "guardian_council_capacity", "service_level_agreement"]
  },
  "qualityGates": {
    "accessibilityStandard": "WCAG2.2-AA",
    "humanCredentialDecision": true,
    "appealPathRequired": true,
    "evidenceProvenanceRequired": true
  }
}
